{
  "$schema": "http://json-schema.org/draft-07/schema#",
  "$id": "https://github.com/aharada54914/sdd-forge/contracts/resolver-evidence.schema.json",
  "title": "SDD Forge Resolver Evidence ÿ€",
  "type": "object",
  "additionalProperties": false,
  "required": ["schema", "feature", "capability_evaluations", "diagnostics"],
  "properties": {
    "schema": { "const": "sdd-resolver-evidence/v1" },
    "feature": { "type": "string", "pattern": "^[a-z0-9][a-z0-9-]*$" },
    "state": { "enum": ["disabled-legacy", "advisory", "required"] },
    "context_binding": {
      "type": "object",
      "additionalProperties": false,
      "required": ["full_context_revision", "dependency_pointers", "projection_sha256", "registry_digest", "ownership_digest"],
      "properties": {
        "full_context_revision": { "$ref": "#/definitions/sha256Digest" },
        "dependency_pointers": { "type": "array", "minItems": 1, "items": { "type": "string" } },
        "projection_sha256": { "$ref": "#/definitions/sha256Digest" },
        "registry_digest": { "$ref": "#/definitions/sha256Digest" },
        "ownership_digest": { "$ref": "#/definitions/sha256Digest" }
      }
    },
    "resolver": {
      "type": "object",
      "additionalProperties": false,
      "required": ["version", "rule_set_revision"],
      "properties": {
        "version": { "type": "string", "pattern": "^[0-9]+\\.[0-9]+\\.[0-9]+$" },
        "rule_set_revision": { "$ref": "#/definitions/sha256Digest" }
      }
    },
    "capability_evaluations": {
      "type": "array",
      "items": { "$ref": "#/definitions/capabilityEvaluation" }
    },
    "diagnostics": {
      "type": "array",
      "items": { "$ref": "#/definitions/diagnostic" }
    }
  },
  "definitions": {
    "capabilityEvaluation": {
      "type": "object",
      "additionalProperties": false,
      "required": ["capability_id", "matched", "trigger_evaluations"],
      "properties": {
        "capability_id": { "type": "string", "minLength": 1 },
        "matched": { "type": "boolean" },
        "trigger_evaluations": {
          "type": "array",
          "items": { "$ref": "#/definitions/componentEvaluation" }
        },
        "conditional_facet_evaluations": {
          "type": "array",
          "items": {
            "type": "object",
            "additionalProperties": false,
            "required": ["facet", "declaration_index", "applied", "evaluations"],
            "properties": {
              "facet": { "type": "string", "minLength": 1 },
              "declaration_index": { "type": "integer", "minimum": 0 },
              "applied": { "type": "boolean" },
              "evaluations": {
                "type": "array",
                "items": { "$ref": "#/definitions/componentEvaluation" }
              }
            }
          }
        }
      },
      "if": { "properties": { "matched": { "const": false } } },
      "then": { "not": { "required": ["conditional_facet_evaluations"] } }
    },
    "componentEvaluation": {
      "type": "object",
      "additionalProperties": false,
      "required": ["component_id", "result", "evidence"],
      "properties": {
        "component_id": { "type": "string", "minLength": 1 },
        "result": { "type": "boolean" },
        "evidence": {
          "type": "array",
          "items": { "$ref": "#/definitions/evidenceNode" }
        }
      }
    },
    "evidenceNode": {
      "type": "object",
      "additionalProperties": false,
      "required": ["operator", "path", "outcome"],
      "properties": {
        "operator": {
          "enum": ["all", "any", "not", "equals", "not_equals",
                   "contains", "in", "exists"]
        },
        "path": { "type": ["string", "null"] },
        "outcome": { "enum": ["match", "no-match", "warn"] },
        "reason": { "type": "string" },
        "children": {
          "type": "array",
          "items": { "$ref": "#/definitions/evidenceNode" }
        }
      },
      "if": { "properties": { "outcome": { "const": "warn" } } },
      "then": { "required": ["operator", "path", "outcome", "reason"] }
    },
    "diagnostic": {
      "type": "object",
      "additionalProperties": false,
      "required": ["id", "detail", "severity"],
      "properties": {
        "id": {
          "enum": ["disabled-legacy-invocation", "publication-journal-recovery",
                   "workflow-combination-invalid",
                   "project-context-validation-failed",
                   "affected-component-resolution-failed", "registry-validation-failed",
                   "contract-discovery-failed", "canonicalizer-invocation-failed",
                   "dependency-subprocess-failed", "dependency-output-malformed",
                   "dsl-warn-on-matched-capability", "lite-check-source-undefined",
                   "output-schema-validation-failed", "snapshot-generation-mismatch",
                   "artifact-publication-failed", "post-publication-generation-mismatch"]
        },
        "detail": { "type": "string" },
        "severity": { "enum": ["block", "warn"] }
      }
    },
    "sha256Digest": {
      "type": "string", "pattern": "^sha256:[0-9a-f]{64}$"
    }
  }
}
